ID_QUESTAO,LABEL_QUESTAO,ENUNCIADO_QUESTAO,ALTERNATIVA_A,ALTERNATIVA_B,ALTERNATIVA_C,ALTERNATIVA_D,ALTERNATIVA_E
101,0,"A perfuração de poços para a extração de petróleo causa soterramento do leito
submarino, contaminação química e aumento da turbidez da água. Além disso, o vazamento
desses hidrocarbonetos gera efeitos adversos, em especial no metabolismo de organismos
aquáticos, influenciando as cadeias alimentares de ecossistemas marinhos. Essas
consequências negativas advêm das propriedades do petróleo, uma mistura oleosa de
substâncias orgânicas, de coloração escura e menos densa que a água.
A consequência do vazamento dessa mistura na produtividade primária do ecossistema é o(a)","redução da atividade do fitoplâncton, em decorrência da alteração na zona fótica.","intoxicação dos animais filtradores, em decorrência da absorção de óleo.","bioacumulação do óleo no zooplâncton, por causa da sua agregação.","mortandade dos peixes, causada pela obstrução das suas brânquias.","dizimação da população de bentônicos, pelo seu soterramento.
"
102,0,"A  combustão completa de combustíveis fósseis produz água e dióxido de carbono (CO2,
massa molar 44 g mol−1). A União Europeia estabeleceu, desde 2012, limite de emissão
veicular de 130 g de CO2 por quilômetro rodado (valor aplicável a uma média de veículos de
um mesmo fabricante), tendo como penalidade multa, caso o fabricante ultrapasse a meta. A
gasolina é uma mistura de hidrocarbonetos com cerca de oito carbonos em sua composição,
incluindo isômeros do octano (C8H18). Considere que em uma cidade o consumo médio diário
dos carros de um fabricante seja de 10 km L−1 de gasolina, formada apenas por
octano (massa molar 114 g mol−1) e que sua densidade seja 0,70 kg L−1.
A diferença de emissão de CO2 dos carros desse fabricante em relação ao limite estabelecido
na União Europeia é","gasolina é uma mistura de hidrocarbonetos com cerca de oito carbonos em sua composição,
incluindo isômeros do octano (C8H18). Considere que em uma cidade o consumo médio diário
dos carros de um fabricante seja de 10 km L−1 de gasolina, formada apenas por
octano (massa molar 114 g mol−1) e que sua densidade seja 0,70 kg L−1.
A diferença de emissão de CO2 dos carros desse fabricante em relação ao limite estabelecido
na União Europeia é",60% menor.,46% menor.,108% maior.,"66% maior.
"
103,0,"No Autódromo de Interlagos, um carro de Fórmula 1 realiza a curva S do Senna numa
trajetória curvilínea. Enquanto percorre esse trecho, o velocímetro do carro indica velocidade
constante.
Quais são a direção e o sentido da aceleração do carro?","Radial, apontada para fora da curva.","Radial, apontada para dentro da curva.","Aceleração nula, portanto, sem direção nem sentido.","Tangencial, apontada no sentido da velocidade do carro.","Tangencial, apontada no sentido contrário à velocidade do carro.
"
104,0,"Alterações no genoma podem ser ocasionadas por falhas nos mecanismos de cópia e
manutenção do DNA, que ocorrem aleatoriamente. Assim, a cada ciclo de replicação do DNA,
existe uma taxa de erro mais ou menos constante de troca de nucleotídeos, independente da
espécie. Partindo-se desses pressupostos, foi construída uma árvore filogenética de alguns
mamíferos, conforme a figura, na qual o comprimento da linha horizontal é proporcional ao
tempo de surgimento da espécie a partir de seu ancestral mais próximo.
ALBERTS, B. et al. Biologia molecular da célula. Nova York: Garland Publisher, 2008.
Qual espécie é geneticamente mais semelhante ao seu ancestral mais próximo?",Cavalo,Ovelha,Veado,Porco,"Vaca
"
105,0,"Os materiais são classificados pela sua natureza química e estrutural, e as diferentes
aplicações requerem características específicas, como a condutibilidade térmica, quando são
utilizados, por exemplo, em utensílios de cozinha. Assim, os alimentos são acondicionados em
recipientes que podem manter a temperatura após o preparo. Considere a tabela, que
apresenta a condutibilidade térmica (
) de diferentes materiais utilizados na confecção de
panelas.
Qual dos materiais é o recomendado para manter um alimento aquecido por um maior
intervalo de tempo?",I,II,III,IV,"V
"
106,0,"Nas últimas décadas vários países, inclusive o Brasil, têm testemunhado uma grande
prolifera 
ção de bactérias patogênicas, envol 
vidas em uma variedade de doenças e que
apresentam resistência a múlti 
plos antibióticos. Atualmente têm se destacado as superbac- 
térias que acumularam vários genes determinantes de resis 
tência, a ponto de se tornarem
resistentes a praticamente todos os antimicrobianos.
FERREIRA, F. A.; CRUZ, R. S.; FIGUEIREDO, A. M. S. O problema da resistência a antibióticos. 
Ciência Hoje, v.48, n.287, 2011 (adaptado).
Essa resistência tem ocorrido porque os(as)",bactérias patogênicas se multiplicam de maneira acelerada.,antibióticos são utilizados pela população de maneira indiscriminada.,bactérias possuem plasmídeos que contêm genes relacionados à virulência.,bactérias podem ser transmitidas para um indivíduo utilizando várias estratégias.,"serviços de saúde precários constituem importantes focos de bactérias patogênicas.
"
107,0,"A ampla diversidade genética é uma característica presente nas plantas fanerógamas,
que ocorreu em razão da presença de estruturas reprodutivas que lhes garantiram o sucesso
adaptativo. Os insetos contribuem para a manutenção e o aumento da variabilidade genética,
ao transportarem diretamente para o órgão reprodutivo da flor uma importante estrutura desse
grupo vegetal.
Qual estrutura vegetal carregada pelos insetos está diretamente relacionada ao incremento do
referido processo nesse grupo vegetal?","Arquegônio, que protege o embrião multicelular","Broto, que propaga vegetativamente as plantas","Fruto, que garante uma maior eficiência na dispersão","Grão de pólen, que favorece a fecundação cruzada","Semente alada, que favorece a dispersão aérea
"
108,0,"Reflorestamento é uma ação ambiental que visa repovoar áreas que tiveram a vegetação
removida. Uma empresa deseja fazer um replantio de árvores e dispõe de cinco produtos que
podem ser utilizados para corrigir o pH do solo que se encontra básico. As substâncias
presentes nos produtos disponíveis são: CH3COONa, NH4Cl, NaBr, NaOH e KCl.
A substância a ser adicionada ao solo para neutralizá-lo é",CH3COONa.,NH4Cl.,NaBr.,NaOH.,"KCl.
"
109,0,"Analise o esquema de uma metodologia utilizada na produção de vacinas contra a
hepatite B.
Disponível em: www.ied.edu.hk. Acesso em: 15 out. 2015 (adaptado).
Nessa vacina, a resposta imune será induzida por um(a)",vírus.,bactéria.,proteína.,levedura.,"ácido nucleico.
"
110,0,"Um fabricante de termômetros orienta em seu manual de instruções que o instrumento
deve ficar três minutos em contato com o corpo para aferir a temperatura. Esses termômetros
são feitos com o bulbo preenchido com mercúrio conectado a um tubo capilar de vidro.
De acordo com a termodinâmica, esse procedimento se justifica, pois é necessário que",o termômetro e o corpo tenham a mesma energia interna.,a temperatura do corpo passe para o termômetro.,o equilíbrio térmico entre os corpos seja atingido.,a quantidade de calor dos corpos seja a mesma.,"o calor do termômetro passe para o corpo.
"
111,0,"Entre os materiais mais usados no nosso dia a dia destacam-se os plásticos, constituídos
por polímeros. A consequência de seu amplo uso é a geração de resíduos, que necessitam de
um destino final adequado em termos ambientais. Uma das alternativas tem sido a reciclagem,
que deve respeitar as características dos polímeros que compõem o material. Esse processo
envolve algumas etapas, como: separação do resíduo (catação), moagem, hidrólise, lavagem,
secagem, pirólise e aquecimento (fusão).
SPINACÉ, M. A. S., PAOLI, M. A. D. Tecnologia de reciclagem de polímeros. Química Nova, n.1, 2005 (adaptado). 
Quais das etapas citadas do processo de reciclagem são classificadas como métodos
químicos?",Hidrólise e pirólise,Secagem e pirólise,Moagem e lavagem,Separação e hidrólise,"Secagem e aquecimento
"
112,0,"É possível identificar adulterantes do leite de vaca por meio da adição do indicador azul de
bromofenol. A presença de agentes oxidantes provoca a descoloração do indicador, mantendo
a cor branca na amostra, característica do leite. Substâncias redutoras presentes no leite
reagem com o azul de bromofenol, gerando a cor verde. A diminuição do valor de pH do leite
torna o indicador amarelo. Em pH mais elevado, o indicador adquire a cor violeta e, em meio
neutro, a cor azul. Considere que um lote industrial de leite em embalagem longa vida foi
adulterado com excesso de soda cáustica.
Em uma inspeção sanitária do lote adulterado, qual será a cor apresentada pelo leite após
adição do indicador azul de bromofenol?",Azul,Verde,Violeta,Branco,"Amarelo
"
113,0,"Considere um banco de dados (Quadro 1) que apresenta sequências hipotéticas de DNA
de duas áreas de extrativismo permitido (A1 e A2) e  duas  áreas  de  conservação (B1 e B2).
Um órgão de fiscalização ambiental recebeu uma denúncia anônima de que cinco lojas
moveleiras (1, 2, 3, 4 e 5) estariam comercializando produtos fabricados com madeira oriunda
de áreas onde a extração é proibida. As sequências de DNA das amostras dos lotes
apreendidos nas lojas moveleiras foram determinadas (Quadro 2).
Quadro 1
Quadro 2
MIRANDA, N. E. O.; ALMEIDA JÚNIOR, E. B. A.; COLLEVATTI, R. G. A genética contra os crimes ambientais:
identificação de madeira ilegal proveniente de unidades de conservação utilizando marcador molecular. 
Genética na Escola, v. 9, n. 2, 2014 (adaptado).
Qual loja moveleira comercializa madeira exclusivamente de forma ilegal?","de duas áreas de extrativismo permitido (A1 e A2) e  duas  áreas  de  conservação (B1 e B2).
Um órgão de fiscalização ambiental recebeu uma denúncia anônima de que cinco lojas
moveleiras (1, 2, 3, 4 e 5) estariam comercializando produtos fabricados com madeira oriunda
de áreas onde a extração é proibida. As sequências de DNA das amostras dos lotes
apreendidos nas lojas moveleiras foram determinadas (Quadro 2).
Quadro 1
Quadro 2
MIRANDA, N. E. O.; ALMEIDA JÚNIOR, E. B. A.; COLLEVATTI, R. G. A genética contra os crimes ambientais:
identificação de madeira ilegal proveniente de unidades de conservação utilizando marcador molecular. 
Genética na Escola, v. 9, n. 2, 2014 (adaptado).
Qual loja moveleira comercializa madeira exclusivamente de forma ilegal?",2,3,4,"5
"
114,0,"Em 2012, a Empresa Brasileira de Pesquisa Agropecuária (Embrapa) divulgou sua
intenção de trabalhar na clonagem de espécies ameaçadas de extinção no Brasil, como é o
caso do lobo-guará, da onça-pintada e do veado-catingueiro. Para tal, células desses animais
seriam coletadas e mantidas em bancos de germoplasma para posterior uso. Dessas células
seriam retirados os núcleos e inseridos em óvulos anucleados. Após um desenvolvimento
inicial in vitro, os embriões seriam transferidos para úteros de fêmeas da mesma espécie. Com
a técnica da clonagem, espera-se contribuir para a conservação da fauna do Cerrado e, se der
certo, essa aplicação pode expandir-se para outros biomas brasileiros.
Disponível em: www.bbc.co.uk. Acesso em: 8 mar. 2013 (adaptado).
A limitação dessa técnica no que se refere à conservação de espécies é que ela",gera clones haploides inférteis.,aumenta a possibilidade de mutantes.,leva a uma diminuição da variabilidade genética.,acarreta numa perda completa da variabilidade fenotípica.,"amplia o número de indivíduos sem capacidade de realizar diferenciação celular.
"
115,0,"O desfibrilador salva vidas de pessoas que são acometidas por ataques cardíacos
ou arritmias. Ele dispõe de um capacitor que pode ser carregado por uma fonte com uma alta
tensão. Usando o desfibrilador, pode-se fornecer energia ao coração, por meio de um choque
elétrico, para que ele volte a pulsar novamente em seu ritmo normal. Um socorrista dispõe de
um desfibrilador com capacitor de 70 microfarads que pode armazenar cerca de 220 J de
energia, quando conectado a uma tensão de 2 500 V.
O valor da carga armazenada por esse desfibrilador, em coulomb, é de","0,015.","0,088.","0,175.","3,15.","11,4.
"
116,0,"Diversos brinquedos são constituídos de pilhas ligadas a um motor elétrico. A figura
mostra uma pilha e um motor acoplados, em que ε representa a força eletromotriz (FEM) da
pilha, ε’ representa a força contraeletromotriz (FCEM) do motor e r e r’ são resistências
internas. Um problema comum que danifica esses brinquedos é o travamento do eixo do
motor.
O que ocorre com a FCEM e com a energia fornecida pelas pilhas, que ocasiona danos ao
motor, quando seu eixo de rotação é travado?","A FCEM iguala-se com a FEM e toda a energia fornecida pela pilha fica armazenada
no circuito.","A FCEM sofre grande aumento e toda a energia fornecida pela pilha passa a ser
dissipada na forma de calor.","A FCEM inverte a polaridade e toda a energia fornecida pela pilha é devolvida para ela
na forma de energia potencial.","A FCEM reduz-se a zero e toda a energia fornecida pela pilha passa a ser dissipada
na resistência interna do motor.","A FCEM mantém-se constante e toda a energia fornecida pela pilha continua sendo
transformada em energia mecânica.
"
117,0,"Fenômenos epigenéticos levam a modificações do DNA e das histonas, que influenciam o
remodelamento da cromatina e, consequentemente, a disponibilização ou não de genes para a
transcrição.
ARRUDA, I. T. S. Epigenética. Genética na Escola, n. 1, 2015 (adaptado).
Esses fenômenos atuam na",regulação da expressão gênica.,alteração nas sequências de bases.,correção de mutações em determinados genes.,associação dos ribossomos ao RNA mensageiro.,"alteração nas sequências dos aminoácidos das histonas.
"
118,0,"O elemento ferro é essencial em nossa alimentação, pois ajuda a prevenir doenças como
a anemia. Normalmente, na alimentação é ingerido na forma de Fe3+, sendo necessário o uso
de agentes auxiliares de absorção, como o ácido ascórbico (vitamina C), cuja ação pode ser
representada pelo esquema reacional a seguir.
A ação do ácido ascórbico ocorre por meio de uma reação de",eliminação.,substituição.,oxirredução.,neutralização.,"hidrogenação.
"
119,0,"Para assegurar a boa qualidade de seu produto, uma indústria de vidro analisou um lote
de óxido de silício (SiO2), principal componente do vidro. Para isso, submeteu uma amostra
desse óxido ao aquecimento até sua completa fusão e ebulição, obtendo ao final um gráfico de
temperatura T (°C) versus tempo t (min). Após a obtenção do gráfico, o analista concluiu que a
amostra encontrava-se pura.
Dados do SiO2: Tfusão = 1 600 °C; Tebulição = 2 230 °C.
Qual foi o gráfico obtido pelo analista?",B,C,D,"E
",
120,0,"A rotação de culturas, juntamente com a cobertura permanente e o mínimo revolvimento
do solo, compõem os princípios básicos do sistema de plantio direto. O aumento da
diversidade biológica do solo contribui para a estabilidade da produção agrícola por causa de
diversos fatores, entre eles o processo de fixação biológica de nitrogênio, realizado por
bactérias.
FRANCHINI, J. C. et al. Importância da rotação de culturas para a produção agrícola sustentável no Paraná.
Londrina: Embrapa Soja, 2011 (adaptado).
Nesse processo biológico, ocorre a transformação de",N2 em NH3.,NO3− em N2.,NH3 em NH4+.,NO2− em NO3−.,"NH4+ em NO2−.
"
121,0,"O custo de implantação de redes de transmissão aumenta linearmente com a distância da
hidroelétrica, de modo que a partir de uma certa distância, o uso de energia solar fotovoltaica,
que não depende da distância, é favorecido. Assim, em regiões isoladas da Amazônia, como é
muito caro levar energia elétrica produzida por hidroelétricas através de redes de transmissão,
o uso  da  energia  solar  fotovoltaica  torna-se uma alternativa viável.
E
Dessa forma, o gráfico que representa qualitativamente os custos do uso de energia solar 
fotovoltaica (ESF) e da implantação de redes de transmissão (RT) em função da distância é",B,C,"D
",,"Dessa forma, o gráfico que representa qualitativamente os custos do uso de energia solar 
fotovoltaica (ESF) e da implantação de redes de transmissão (RT) em função da distância é"
122,0,"Os objetos de prata tendem a escurecer com o tempo, em contato com compostos de
enxofre, por causa da formação de uma película superficial de sulfeto de prata (Ag2S), que é
escuro. Um método muito simples para restaurar a superfície original desses objetos é
mergulhá-los em uma solução diluída aquecida de hidróxido de sódio (NaOH), contida em uma
panela comum de alumínio. A equação química que ilustra esse processo é:
3 Ag2S (s) + 2 Al (s)  + 8 NaOH (aq) → 6 Ag (s) + 3 Na2S (aq) + 2 NaAlO2 (aq) + 4 H2O (l)
A  restauração do objeto de prata ocorre por causa do(a)","prata, que reduz o enxofre.","íon sulfeto, que sofre oxidação.","íon hidróxido, que atua como agente oxidante.","alumínio, que atua como agente redutor no processo.","variação do pH do meio reacional, que aumenta durante a reação.
"
123,0,"O reagente conhecido como Kastle-Meyer é muito utilizado por investigadores criminais
para detectar a presença de sangue. Trata-se de uma solução aquosa incolor, preparada com
zinco metálico, hidróxido de sódio (Reação 1) e indicador (Reação 2). Essa solução, quando
em contato com a hemoglobina contida no sangue e na presença de água oxigenada (Reação
3), passa de incolor para vermelha, indicando a presença de sangue no local, conforme as
reações descritas.
DIAS FILHO, C. R.; ANTEDOMENICO, E. A perícia criminal e a interdisciplinaridade no ensino de ciências naturais.
Química Nova na Escola, n. 2, maio 2010 (adaptado).
A mudança de coloração que indica a presença de sangue ocorre por causa da reação do
indicador com o(a)",sal de Na2[Zn(OH)4] na presença de hemoglobina.,água produzida pela decomposição da água oxigenada.,hemoglobina presente na reação com a água oxigenada.,gás oxigênio produzido pela decomposição da água oxigenada.,"gás hidrogênio produzido na reação do zinco com hidróxido de sódio.
"
124,0,"Pesquisadores delimitaram Unidades Evolutivas Significativas (UES) de cinco espécies
pertencentes a diferentes grupos de vertebrados, distribuídos em oito áreas distintas, como
mostra o quadro. Cada UES representa uma população isolada histórica e geneticamente
diferenciada e apresenta prioridade para manejo e conservação.
MIRANDA, N. E. O.; ALMEIDA JR., E. B.; COLLEVATTI, R. G. Priorizando áreas para a conservação com base em
Unidades Evolutivas Significativas (ESU). Genética na Escola, n.1, 2015 (adaptado).
Considerando a área 4, a espécie que terá prioridade nas estratégias de conservação pertence
a que grupo?",Ave,Anfíbio,Roedor,Lagarto,"Morcego
"
125,0,"Um pesquisador colocou a mesma quantidade de solução aquosa da enzima digestiva
pepsina em cinco tubos de ensaio. Em seguida, adicionou massas iguais dos alimentos
descritos no quadro. Os alimentos foram deixados em contato com a solução digestiva durante
o mesmo intervalo de tempo.
A maior quantidade de produtos metabolizados ao final do teste foi obtida no tubo",I.,II.,III.,IV.,"V.
"
126,0,"A composição de um dos refrigerantes mais ácidos mundialmente consumido é mantida
em segredo pelos seus produtores. Existe uma grande especulação em torno da ""fórmula""
dessa bebida, a qual envolve algumas das seguintes substâncias:
A substância presente nesse refrigerante, responsável pelo seu acentuado caráter ácido, é a",I.,II.,III.,IV.,"V.
"
127,0,"No final do século XIX, muitos cientistas estavam interessados nos intrigantes fenômenos
observados nas ampolas de raios catódicos, que são tubos sob vácuo em que se ligam duas
placas a uma fonte de alta tensão. Os raios catódicos passam através de um orifício no ânodo
e continuam o percurso até a outra extremidade do tubo, onde são detectados pela
fluorescência produzida ao chocarem-se com um revestimento especial, como pode ser
observado na figura. Medições da razão entre a carga e a massa dos constituintes dos raios
catódicos mostram que a sua identidade independe do material do cátodo ou do gás dentro
das ampolas.
CHANG, R.;  GOLDSBY, K. A. Química. Porto Alegre: Bookman, 2013 (adaptado).
Essa radiação invisível detectada nas ampolas é constituída por",ânions.,cátions.,prótons.,elétrons.,"partículas alfa.
"
128,0,"Uma nova e revolucionária técnica foi desenvolvida para a edição de genomas. O
mecanismo consiste em um sistema de reconhecimento do sítio onde haverá a mudança do
gene combinado com um mecanismo de corte e reparo do DNA. Assim, após o
reconhecimento do local onde será realizada a edição, uma nuclease corta as duas fitas de
DNA. Uma vez cortadas, mecanismos de reparação do genoma tendem a juntar as fitas
novamente, e nesse processo um pedaço de DNA pode ser removido, adicionado ou até
mesmo trocado por outro pedaço de DNA.
Nesse contexto, uma aplicação biotecnológica dessa técnica envolveria o(a)",diagnóstico de doenças.,identificação de proteínas.,rearranjo de cromossomos.,modificação do código genético.,"correção de distúrbios genéticos.
"
129,0,"Em uma das etapas do processo de produção de iogurte, esquematizado na figura, ocorre
a mudança da consistência característica do leite, de líquido para gel.
ROBERT, N. R. Disponível em: www.respostatecnica.org.br. Acesso em: 26 fev. 2012 (adaptado).
Em qual etapa ocorre essa mudança de consistência?",1,2,3,4,"5
"
130,0,"As pilhas recarregáveis, bastante utilizadas atualmente, são formadas por sistemas que
atuam como uma célula galvânica, enquanto estão sendo descarregadas, e como célula
eletrolítica, quando estão sendo recarregadas.
Uma pilha é formada pelos elementos níquel e cádmio e seu carregador deve fornecer
uma diferença de potencial mínima para promover a recarga. Quanto maior a diferença de
potencial gerada pelo carregador, maior será o seu custo. Considere os valores de potencial
padrão de redução dessas espécies:
Ni2+ (aq) + 2 e− 
 Ni (s)
E° = −0,230 V
Cd2+ (aq) + 2 e− 
 Cd (s)
E° = −0,402 V
Teoricamente, para que um carregador seja ao mesmo tempo eficiente e tenha o menor preço,
a diferença de potencial mínima, em volt, que ele deve superar é de","0,086.","0,172.","0,316.","0,632.","1,264.
"
131,0,"O leite UHT (do inglês Ultra-High Temperature) é o leite tratado termicamente por um
processo que recebe o nome de ultrapasteurização. Elevando sua temperatura
homogeneamente a 135 °C por apenas 1 ou 2 segundos, o leite é esterilizado sem prejudicar
significativamente seu sabor e aparência. Desse modo, ele pode ser armazenado, sem a
necessidade de refrigeração, por meses. Para alcançar essa temperatura sem que a água que
o compõe vaporize, o leite é aquecido em alta pressão. É necessário, entretanto, resfriar o leite
rapidamente para evitar o seu cozimento. Para tanto, a pressão é reduzida subitamente, de
modo que parte da água vaporize e a temperatura diminua.
O processo termodinâmico que explica essa redução súbita de temperatura é a",convecção induzida pelo movimento de bolhas de vapor de água.,emissão de radiação térmica durante a liberação de vapor de água.,expansão livre do vapor de água liberado pelo leite no resfriamento.,conversão de energia térmica em energia química pelas moléculas orgânicas.,"transferência de energia térmica durante a vaporização da água presente no leite.
"
132,0,"Um produtor de morangos notou, no início da manhã, que em alguns pontos das
extremidades das folhas dos morangueiros ocorriam gotículas de água. Procurando
informação a respeito do fenômeno, o agricultor descobre que isso é também observado em
outras plantas herbáceas de pequeno porte.
Esse fenômeno fisiológico ocorre em condições de elevada umidade do ar e",escassez de sais minerais.,abundante suprimento hídrico.,abundante período de transpiração.,ausência de resistência estomática.,"ausência de substâncias impermeabilizantes.
"
133,0,"BTU é a sigla para British Thermal Unit (Unidade Térmica Inglesa), que é definida como a
quantidade de calor necessária para elevar a temperatura de 1 libra (0,45 kg) de água de 59,5
°F a 60,5 °F sob pressão constante de 1 atmosfera. A unidade BTU é utilizada, de forma
errônea, por diversos profissionais como sendo a potência de resfriamento do aparelho.
RODITI, I. Dicionário Houaiss de Física. Rio de Janeiro: Objetiva, 2005 (adaptado).
Como se pode representar corretamente a unidade de potência com base na definição de
BTU?",BTU × h−1,BTU × m2,BTU × h−1 × m2,BTU × h,"BTU × m−2
Matemática e suas Tecnologias
"
