ID_QUESTAO,LABEL_QUESTAO,ENUNCIADO_QUESTAO,ALTERNATIVA_A,ALTERNATIVA_B,ALTERNATIVA_C,ALTERNATIVA_D,ALTERNATIVA_E
311,0,"Vanda vinha do interior de Minas Gerais e de dentro de um livro de Charles Dickens.
Sem dinheiro para criá-la, sua mãe a dera, com seus sete anos, a uma conhecida. Ao
recebê-la, a mulher perguntou o que a garotinha gostava de comer. Anotou tudo num
papel. Mal a mãe virou as costas, no entanto, a fulana amassou a lista e, como uma vilã
de folhetim, decretou: “A partir de hoje, você não vai mais nem sentir o cheiro dessas
comidas!”.
Vanda trabalhou lá até os quinze anos, quando recebeu a carta de uma prima com
uma nota de cem cruzeiros, saiu de casa com a roupa do corpo e fugiu num ônibus para
São Paulo.
Todas as vezes que eu e minha irmã a importunávamos com nossas demandas de
criança mimada, ela nos contava histórias da infância de gata-borralheira, fazia-nos
apertar seu nariz quebrado por uma das filhas da “patroa” com um rolo de amassar pão e
nos expulsava da cozinha: “Sai pra lá, peste, e me deixa acabar essa janta”.
PRATA, A. Nu de botas. São Paulo: Cia. das Letras, 2013 (adaptado).
Pela ótica do narrador, a trajetória da empregada de sua casa assume um efeito
expressivo decorrente da",citação a referências literárias tradicionais.,alusão à inocência das crianças da época.,estratégia de questionar a bondade humana.,descrição detalhada das pessoas do interior.,"representação anedótica de atos de violência.
/
"
312,0,"TEXTO I 
SILVEIRA, R. In absentia, 1983. Instalação, 17ª Bienal de São Paulo.
Disponível em: www.bienal.org.br. Acesso em: 1 set. 2016 (adaptado).
TEXTO II
O termo ready-made foi criado por Marcel Duchamp (1887-1968) para designar um
tipo de objeto, por ele inventado, que consiste em um ou mais artigos de uso cotidiano,
produzidos em massa, selecionados sem critérios estéticos e expostos como obras de
arte em espaços especializados (museus e galerias). Seu primeiro ready-made, de 1912,
é uma roda de bicicleta montada sobre um banquinho (Roda de bicicleta). Ao transformar
qualquer objeto em obra de arte, o artista realiza uma crítica radical ao sistema da arte.
Disponível em: www.bienal.org.br. Acesso em: 1 set. 2016 (adaptado).
 
/
A instalação In absentia propõe um diálogo com o ready-made Roda de bicicleta,
demonstrando que",as formas de criticar obras do passado se repetem.,a recorrência de temas marca a arte do final do século XX.,as criações desmistificam os valores estéticos estabelecidos.,o distanciamento temporal permite a transformação dos referenciais estéticos.,"o objeto ausente sugere a degradação da forma superando o modelo artístico.
/
"
313,0,"O Recife fervilhava no começo da década de 1990, e os artistas trabalhavam para
resgatar o prestígio da cultura pernambucana. Era preciso se inspirar, literalmente, nas
raízes sobre as quais a cidade se construiu. Foi aí que, em 1992, com a publicação de um
manifesto escrito pelo músico e jornalista Fred Zero Quatro, da banda Mundo Livre S/A,
nasceu o manguebeat. O nome vem de “mangue”, vegetação típica da região, e “beat”,
para representar as batidas e as influências musicais que o movimento abraçaria a partir
dali. Era a hora e a vez de os caranguejos — aos quais os músicos recifenses gostavam
de se comparar — mostrarem as caras: o maracatu e suas alfaias se misturaram com as
batidas do hip-hop, as guitarras do rock, elementos eletrônicos e o sotaque recifense de
Chico Science. A busca pelo novo rendeu uma perspectiva diferente do Brasil ao olhar
para o Recife. A cidade deixou de ser o lugar apenas do frevo e do carnaval,
transformando-se na ebulição musical que continua a acontecer mesmo após os 25 anos
do lançamento do primeiro disco da Nação Zumbi, Da lama ao caos.
FORCIONI, G. et al. O mangue está de volta. Revista Esquinas, n. 87, set. 2019 (adaptado).
Chico Science foi fundamental para a renovação da música pernambucana, fato que se
deu pela","utilização de aparelhos musicais eletrônicos em lugar dos instrumentos
tradicionais.","ocupação de espaços da natureza local para a produção de eventos musicais
memoráveis.","substituição de antigas práticas musicais, como o frevo, por melodias e harmonias
inovadoras.","recuperação de composições tradicionais folclóricas e sua apresentação em
grandes festivais.","integração de referenciais culturais de diferentes origens, criando uma nova
combinação estética.
/
Redação
Instruções - Redação
INSTRUÇÕES PARA A REDAÇÃO
1.
O rascunho da redação deve ser feito no espaço apropriado.
2.
O texto definitivo deve ser escrito à tinta preta, na folha própria, em até 30 linhas.
3.
A redação que apresentar cópia dos textos da Proposta de Redação ou do Caderno
de Questões terá o número de linhas copiadas desconsiderado para a contagem de
linhas.
4.
Receberá nota zero, em qualquer das situações expressas a seguir, a redação
que:
 
4.1. tiver até 7 (sete) linhas escritas, sendo considerada “texto insuficiente”;
4.2. fugir ao tema ou não atender ao tipo dissertativo-argumentativo;
4.3. apresentar parte do texto deliberadamente desconectada do tema proposto;
4.4. apresentar nome, assinatura, rubrica ou outras formas de identificação no
espaço destinado ao texto.
/
Proposta - Redação
TEXTO I
Você sabe quais são as comunidades e os povos tradicionais brasileiros? Talvez
indígenas e quilombolas sejam os primeiros que passam pela cabeça, mas, na verdade,
além deles, existem 26 reconhecidos oficialmente e muitos outros que ainda não foram
incluídos na legislação.
São pescadores artesanais, quebradeiras de coco babaçu, apanhadores de flores
sempre-vivas, caatingueiros, extrativistas, para citar alguns, todos considerados
culturalmente diferenciados, capazes de se reconhecerem entre si.
Para uma pesquisadora da UnB, essas populações consideram a terra como uma
mãe, e há uma relação de reciprocidade com a natureza. Nessa troca, a natureza fornece
“alimento, um lugar saudável para habitar, para ter água. E elas se responsabilizam por
cuidar dela, por tirar dela apenas o suficiente para viver bem e respeitam o tempo de
regeneração da própria natureza”, diz.
Disponível em: https://g1.globo.com. Acesso em: 17 jun. 2022 (adaptado).
TEXTO II
Povos tradicionais do Brasil 
Estados com a maior concentração de famílias
Povos de terreiro
BA
PI
CE
1.883
856
603
Fonte: Ministério Público Federal.
Infográfico elaborado em: 25/10/2019.
Quilombola
BA
MA
PA
43.009
39.316
15.282
Cigano
BA
GO
MG
1.538
643
556
Ribeirinho
PA
AM
BA
50.314
16.507
9.670
Extrativista
PA
AM
MA
11.826
9.772
7.190
Pescador
PA
MA
BA
40.123
33.085
30.920
AM
MS
RR
43.264
21.507
15.316
Indígena
Disponível em: https://g1.globo.com. Acesso em: 17 jun. 2022 (adaptado).
 
TEXTO III
Povos e comunidades tradicionais
O Ministério do Desenvolvimento Social (MDS) preside, desde 2007, a Comissão
Nacional de Desenvolvimento Sustentável dos Povos e Comunidades Tradicionais
(CNPCT), criada em 2006. Fruto dos trabalhos da CNPCT, foi instituída, por meio do
Decreto nº 6.040, de 7 de fevereiro de 2017, a Política Nacional de Desenvolvimento
Sustentável dos Povos e Comunidades Tradicionais (PNPCT). A PNPCT foi criada em um
contexto de busca de reconhecimento e preservação de outras formas de organização
social por parte do Estado.
Disponível em: http://mds.gov.br. Acesso em: 17 jun. 2022 (adaptado).
 
/
TEXTO IV
Carta da Amazônia 2021
Aos participantes da 26ª Conferência das Nações Unidas sobre Mudanças Climáticas
(COP26)
Não podia ser mais estratégico para nós, Povos Indígenas, Populações e
Comunidades Tradicionais brasileiras, reafirmarmos a defesa da sociobiodiversidade
amazônica neste momento em que o mundo volta a debater a crise climática na COP26.
Uma crise que atinge, em todos os contextos, os viventes da Terra!
Nossos territórios protegidos e direitos respeitados são as reivindicações dos
movimentos sociais e ambientais brasileiros.
Não compactuamos com qualquer tentativa e estratégia baseada somente na lógica
do mercado, com empresas que apoiam legislações ambientais que ameaçam nossos
direitos e com mecanismos de financiamento que não condizem com a realidade dos
nossos territórios.
Propomos o que temos de melhor: a experiência das nossas sociedades e culturas
históricas, construídas com base em nossos saberes tradicionais e ancestrais, além de
nosso profundo conhecimento da natureza.
Inovação, para nós, não pode resultar em processos que venham a ameaçar nossos
territórios, nossas formas tradicionais e harmônicas de viver e produzir.
Amazônia, Brasil, 20 de outubro de 2021.
Entidades signatárias: CNS; Coiab; Conaq; MIQCB; Coica; ANA Amazônia e Confrem
Disponível em: https://s3.amazonaws.com. Acesso em: 17 jun. 2022 (adaptado).
PROPOSTA DE REDAÇÃO
A partir da leitura dos textos motivadores e com base nos conhecimentos construídos ao
longo de sua formação, redija um texto dissertativo-argumentativo em modalidade escrita
formal da língua portuguesa sobre o tema “Desafios para a valorização de comunidades e
povos tradicionais no Brasil”, apresentando proposta de intervenção que respeite os
direitos humanos. Selecione, organize e relacione, de forma coerente e coesa,
argumentos e fatos para a defesa de seu ponto de vista.
/
Ciências Humanas e suas Tecnologias
"
314,1,"Espera, resignado, o dia 13 daquele mês porque, em tal data, usança avoenga lhe
faculta sondar o futuro, interrogando a providência. É a experiência tradicional de Santa
Luzia. No dia 12 ao anoitecer expõe ao relento, em linha, seis pedrinhas de sal, que
representam, em ordem sucessiva da esquerda para a direita, os seis meses vindouros,
de janeiro a junho. Ao alvorecer de 13 observa-as: se estão intactas, pressagiam a seca;
se a primeira apenas se deliu, transmudada em aljôfar límpido, é certa a chuva em
janeiro; se a segunda, em fevereiro; se a maioria ou todas, é inevitável o inverno
benfazejo. Esta experiência é belíssima.
CUNHA, E. Os sertões. São Paulo: Editora Três, 1984.
No experimento descrito, a relação com a paisagem e com a religiosidade permite que o
sertanejo seja",afeito à devoção ao aceitar destinos sacralizados.,acostumado à pobreza ao admitir acasos naturais.,habituado ao solo ao conhecer terrenos cultiváveis.,íntimo à Caatinga ao interpretar condições ambientais.,"próximo à vegetação ao identificar espécies arbustivas.
/
"
315,1,"Sempre que a relevância do discurso entra em jogo, a questão torna-se política por
definição, pois é o discurso que faz do homem um ser político. E tudo que os homens
fazem, sabem ou experimentam só tem sentido na medida em que pode ser discutido.
Haverá, talvez, verdades que ficam além da linguagem e que podem ser de grande
relevância para o homem no singular, isto é, para o homem que, seja o que for, não é um
ser político. Mas homens no plural, isto é, os homens que vivem e se movem e agem
neste mundo, só podem experimentar o significado das coisas por poderem falar e ser
inteligíveis entre si e consigo mesmos.
ARENDT, H. A condição humana. Rio de Janeiro: Forense Universitária, 2004.
No trecho, a filósofa Hannah Arendt mostra a importância da linguagem no processo de",entendimento da cultura.,aumento da criatividade.,percepção da individualidade.,melhoria da técnica.,"construção da sociabilidade.
/
"
316,1,"Eu estava pagando o sapateiro e conversando com um preto que estava lendo um
jornal. Ele estava revoltado com um guarda civil que espancou um preto e amarrou numa
árvore. O guarda civil é branco. E há certos brancos que transforma preto em bode
expiatório. Quem sabe se guarda civil ignora que já foi extinta a escravidão e ainda
estamos no regime da chibata?
JESUS, C. M. Quarto de despejo: diário de uma favelada. São Paulo: Ática, 2014.
O texto, que guarda a grafia original da autora, expõe uma característica da sociedade
brasileira, que é o(a):",Racismo estrutural.,Desemprego latente.,Concentração de renda.,Exclusão informacional.,"Precariedade da educação.
/
"
317,1,"PAZ, A. D. Disponível em: www.ct.ufpb.br. Acesso em: 15 out. 2021 (adaptado).
 
/
A intensificação da ocupação urbana demonstrada afeta de forma imediata o(a)",nível altimétrico.,ciclo hidrológico.,padrão climático.,tectônica de placas.,"estrutura das rochas.
/
"
318,1,"Na construção da ferrovia Madeira-Mamoré, o que dizer dos doentes, eternos
moribundos a vagar entre delírios febris, doses de quinino e corredores da morte? O
Hospital da Candelária era santuário e túmulo, monumento ao progresso científico e
preâmbulo da escuridão. Foi ali, com suas instalações moderníssimas, que médicos e
sanitaristas dirigiram seu combate aos males tropicais. As maiores vítimas, contudo,
permaneceriam na sombra à margem do palco, cobaias sem consolo, credores sem nome
de uma sociedade que não lhes concedera tempo algum para ser decifrada.
FOOT HARDMAN, F. Trem fantasma: modernidade na selva. São Paulo: Cia. das Letras, 1988 (adaptado).
No texto, há uma crítica ao modo de ocupação do espaço amazônico pautada na",discrepância entre engenharia ambiental e equilíbrio da fauna.,incoerência entre maquinaria estrangeira e controle da floresta.,incompatibilidade entre investimento estatal e proteção aos nativos.,competição entre farmacologia internacional e produtos da fitoterapia.,"contradição entre desenvolvimento nacional e respeito aos trabalhadores.
/
"
319,1,"Uma nova economia surgiu em escala global no último quartel do século XX.
Chamo-a de informacional, global e em rede para identificar suas características
fundamentais e diferenciadas e enfatizar sua interligação. É informacional porque
depende basicamente de sua capacidade de gerar, processar e aplicar de forma eficiente
a informação baseada em conhecimentos. É global porque seus componentes estão
organizados em escala global, diretamente ou mediante uma rede de conexões entre
agentes econômicos. É rede porque é feita em uma rede global de interação entre redes
empresariais.
CASTELLS, M. A sociedade em rede — a era da informação: economia, 
sociedade e cultura. São Paulo: Paz e Terra, 1999 (adaptado).
Qual mudança estrutural é resultado da forma de organização econômica descrita no
texto?",Fabricação em série.,Ampliação de estoques.,Fragilização dos cartéis.,Padronização de mercadorias.,"Desterritorialização da produção.
/
"
320,1,"Olhar o Brasil e não ver o sertão 
É como negar o queijo com a faca na mão 
Esse gigante em movimento
Movido a tijolo e cimento 
Precisa de arroz com feijão 
Que tenha comida na mesa 
Que agradeça sempre a grandeza 
De cada pedaço de pão 
Agradeça a Clemente 
Que leva a semente 
Em seu embornal 
Zezé e o penoso balé 
De pisar no cacau 
Maria que amanhece o dia
Lá no milharal
VANDER LEE. Do Brasil. In: Pensei que fosse o céu: ao vivo. Rio de Janeiro: Indie Records, 2006 (fragmento).
A letra da canção valoriza uma dimensão do espaço rural brasileiro em sua relação com a
cidade ao ressaltar sua função de",fornecer a mão de obra qualificada.,incorporar a inovação tecnológica.,preservar a diversidade biológica.,promover a produção alimentar.,"garantir a moradia básica.
/
"
321,1,"O número cada vez maior de mulheres letradas e interessadas pela literatura e pelas
novelas, muitas divulgadas em capítulos, seções, classificadas comumente como
folhetim, alçou a um gênero de ficção corrente já em 1840, fazendo parte do florescimento
da literatura nacional brasileira, instigando a formação e a ampliação de um público leitor
feminino, ávido por novidades, pelo apelo dos folhetins e “narrativas modernas” que
encenavam “os dramas e os conflitos de uma mulher em processo de transformação
patriarcal e provinciana que, progressivamente, começava a se abrir para modernizar
seus costumes”. No Segundo Reinado, as mulheres foram se tornando público
determinante na construção da literatura e da imprensa nacional. E não apenas público,
porquanto crescerá o número de escritoras que colaboram para isso e emergirá uma
imprensa feminina, editada, escrita e dirigida por e para mulheres.
ABRANTES, A. Do álbum de família à vitrine impressa: trajetos de retratos (PB, 1920),  
Revista Temas em Educação, n. 24, 2015 (adaptado).
O registro das atividades descritas associa a inserção da figura feminina nos espaços de
leitura e escrita do Segundo Reinado ao(à)",surgimento de novas práticas culturais.,contestação de antigos hábitos masculinos.,valorização de recentes publicações juvenis.,circulação de variados manuais pedagógicos.,"aparecimento de diversas editoras comerciais.
/
"
322,1,"Os caixeiros do comércio a retalho do Rio de Janeiro estiveram entre as primeiras
categorias de trabalhadores a se organizar em associações e a exigir a intervenção dos
poderes públicos na mediação de suas lutas por direitos. Na década de 1880, os caixeiros
participaram da arena política e ganharam as ruas com vários outros, como os
republicanos e os abolicionistas.
POPINIGIS, F. “Todas as liberdades são irmãs”: os caixeiros e as lutas dos trabalhadores por direitos
entre o Império e a República. Estudos Históricos, n. 59, set.-dez. 2016 (adaptado).
A atuação dos trabalhadores mencionados no texto representou, na capital do Império,
um momento de",manutenção das regras patronais.,desprendimento das ideias liberais.,fortalecimento dos contratos laborais.,consolidação das estruturas sindicais.,"contestação dos princípios monárquicos.
/
"
323,1,"Solos salinos ou alomórficos apresentam como característica comum uma
concentração muito alta de sais solúveis e/ou de sódio trocável. Eles ocorrem nos locais
mais baixos do relevo, em regiões áridas e semiáridas e próximas do mar. Em regiões
semiáridas, por exemplo, o polígono das secas do Nordeste brasileiro, os locais menos
elevados recebem água que se escoa dos declives adjacentes, durante as chuvas que
caem em alguns meses do ano. Essa água traz soluções de sais minerais e evapora-se
rapidamente antes de infiltrar-se totalmente, havendo então, cada vez que esse processo
é repetido, um pequeno acúmulo de sais no horizonte superficial que, com o passar dos
anos, provoca a salinização do solo. Nas últimas décadas, a expansão das atividades
agrícolas na região tem ampliado esse processo.
LEPSCH, I. F. Solos: formação e conservação. São Paulo: Melhoramentos, 1993 (adaptado).
As atividades agrícolas, desenvolvidas na região mencionada, intensificam o problema
ambiental exposto ao","realizar florestamentos de pinus, desrespeitando a prática do pousio.","utilizar sistemas de irrigação, desprezando uma drenagem adequada.","instalar açudes nos grotões, retardando a velocidade da vazão fluvial.","desmatar áreas de preservação permanente, causando assoreamento.","aplicar fertilizantes de origem orgânica, modificando a química da terra.
/
"
324,1,"TEXTO I
CAZO. Disponível em: www.humorpolitico.com.br. Acesso em: 21 nov. 2021 (adaptado).
TEXTO II
É como se os problemas fossem criados pela pandemia quando, em verdade, isso só
demonstra o quanto eles sofrem uma tentativa de serem naturalizados. Eles estavam lá,
empurrados para debaixo de vários tapetes. Diversos levantamentos realizados indicam
que parcela significativa dos estudantes não têm acesso à internet em suas casas, não
têm computadores; têm celulares, mas com pacotes baratos que não permitem assistir a
todas as aulas. E, caso tenham celulares e dados, pergunta-se: É possível elaborar um
texto no celular? É possível interagir na aula remota pelo celular?
ASSIS, A. E. S. Q. Educação e pandemia. Educação em Revista, n. 37, 2021 (adaptado).
A crítica contida no texto e na figura evidencia o seguinte aspecto da sociedade
contemporânea:",Exclusão social.,Expansão digital.,Manifestação cultural.,Organização espacial.,"Valorização intelectual.
/
"
325,1,"O leproso é visto dentro de uma prática da rejeição, do exílio-cerca; deixa-se que se
perca lá dentro como numa massa que não tem muita importância diferenciar; os
pestilentos são considerados num policiamento tático meticuloso onde as diferenciações
individuais são os efeitos limitantes de um poder que se multiplica, se articula e se
subdivide. O grande fechamento por um lado; o bom treinamento por outro. A lepra e sua
divisão; a peste e seus recortes. Uma é marcada; a outra, analisada e repartida. O exílio
do leproso e a prisão da peste não trazem consigo o mesmo sonho político.
FOUCAULT, M. Vigiar e punir: nascimento da prisão. Petrópolis: Vozes, 1987.
Os modelos autoritários descritos no texto apontam para um sistema de controle que se
baseia no(a):",Formação de sociedade disciplinar.,Flexibilização do regramento social.,Banimento da autoridade repressora.,Condenação da degradação humana.,"Hierarquização da burocracia estatal.
/
"
326,1,"TEXTO I
Em março de 1889, quando apareceram as primeiras romarias atraídas pelos
milagres da beata Maria de Araújo, Juazeiro inseriu-se no rol da fundação do espaço
religioso. Construía-se mais um centro, como Aparecida do Norte, Canindé ou Lourdes.
RAMOS, F. R. L. O meio do mundo: território sagrado em Juazeiro do Padre Cícero.  
Fortaleza: Imprensa Universitária, 2014.
TEXTO II
Não sabemos ao certo quantas pessoas estavam presentes na capela no momento
em que a hóstia sangrou na boca de Maria de Araújo. O Padre Cícero nos conta que o
fato surpreendeu não só aos presentes, mas a própria beata parecia atordoada com o
ocorrido. O fenômeno continuou acontecendo todas as quartas e sextas na Capela de
Nossa Senhora das Dores a partir daquele dia. Os paninhos manchados do sangue que
escorria da hóstia e da boca da beata, a princípio, ficaram sob a guarda do Padre Cícero,
mas logo foram expostos à visitação pública e, além disso, o sangramento foi proclamado
como milagre sem o conhecimento e sem a autorização do bispo diocesano.
NOBRE, E. Incêndios da alma. Rio de Janeiro: Multifoco, 2016 (adaptado).
As práticas religiosas mencionadas nos textos estão associadas, respectivamente, à:",Delimitação de paisagens urbanas e abandono de componentes espiritualistas.,Demarcação de patrimônios afetivos e apropriação de elementos judaizantes.,Expansão de fronteiras regionais e subjetivação do cristianismo medieval.,Circunscrição de bens simbólicos e admissão de cerimônias ecumênicas.,"Criação de lugares místicos e experiências do catolicismo popular.
/
"
327,1,"Em 2003, teve início o Programa de Aquisição de Alimentos e, com ele, várias
mudanças na perspectiva dos mercados institucionais. Trata-se do primeiro programa de
compras públicas com uma orientação exclusiva para a agricultura familiar, articulando-a
explicitamente com a segurança alimentar e nutricional. O Programa é destinado à
aquisição de produtos agropecuários produzidos por agricultores enquadrados no
Programa Nacional de Fortalecimento da Agricultura Familiar (Pronaf), incluídas aqui as
categorias: assentados da reforma agrária, trabalhadores rurais sem terra, acampados,
quilombolas, agroextrativistas, famílias atingidas por barragens e comunidades indígenas.
GRISA, C.; ISOPO, S. P. Dez anos de PAA: as contribuições e os desafios para o desenvolvimento rural. In: GRISA,
C.; SCHNEIDER, S. (Org.). Políticas públicas de desenvolvimento rural no Brasil. Porto Alegre: UFRGS, 2015.
A ação governamental descrita constitui-se uma importante conquista para os pequenos
produtores em virtude da:",Inovação tecnológica.,Reestruturação fundiária.,Comercialização garantida.,Eliminação no custo do frete.,"Negociação na bolsa de valores.
/
"
328,1,"Um experimento denominado FunFit foi desenvolvido com o objetivo de fazer com
que os membros de uma comunidade local se tornassem mais ativos fisicamente. Todos
os participantes do estudo foram vinculados a dois outros membros da comunidade que
receberiam pequenos incentivos em dinheiro para serem estimulados a aumentar a sua
atividade física, que era medida por acelerômetros nos celulares fornecidos pelo estado.
Assim, se a pessoa andasse mais do que o habitual, seus conhecidos receberiam o
dinheiro. Os resultados foram assombrosos: o esquema mostrou-se de quatro a oito
vezes mais eficaz do que o método de oferecer incentivos individuais.
MOROZOV, E. Big Tech: a ascensão dos dados e a morte da política. São Paulo: Ubu, 2018 (adaptado).
Contrariando a visão prevalente sobre o impacto tecnológico nas relações humanas, o
texto revela que os celulares podem desempenhar uma função","recreativa, promovendo o lazer em redes integradas.","social, estimulando a reciprocidade por meios digitais.","laboral, convertendo o desenvolvedor em usuário final.","comercial, direcionando a escolha por produtos industrializados.","cognitiva, favorecendo a aprendizagem pelas ferramentas virtuais.
/
"
