ID_QUESTAO,LABEL_QUESTAO,ENUNCIADO_QUESTAO,ALTERNATIVA_A,ALTERNATIVA_B,ALTERNATIVA_C,ALTERNATIVA_D,ALTERNATIVA_E
167,0,"Disponível em: https://g1.globo.com. Acesso em: 18 jun. 2019 (adaptado).
No texto, os recursos verbais e não verbais empregados têm por objetivo","divulgar informações científicas sobre o uso indiscriminado de aparelhos
celulares.","influenciar o leitor a mudar atitudes e hábitos considerados prejudiciais às
crianças.","relacionar o uso da tecnologia aos efeitos decorrentes da falta de exercícios
físicos.","indicar medidas eficazes para desestimular a utilização de telefones pelo público
infantil.","sugerir aos pais e responsáveis a substituição de dispositivos móveis por
atividades lúdicas.
"
168,0,"Singular ocorrência
— Há ocorrências bem singulares. Está vendo aquela dama que vai entrando na igreja
da Cruz? Parou agora no adro para dar uma esmola.
— De preto?
— Justamente; lá vai entrando; entrou.
— Não ponha mais na carta. Esse olhar está dizendo que a dama é uma recordação
de outro tempo, e não há de ser muito tempo, a julgar pelo corpo: é moça de truz.
— Deve ter quarenta e seis anos.
— Ah! conservada. Vamos lá; deixe de olhar para o chão e conte-me tudo. Está viúva,
naturalmente?
— Não.
— Bem; o marido ainda vive. É velho?
— Não é casada.
— Solteira?
— Assim, assim. Deve chamar-se hoje D. Maria de tal. Em 1860 florescia com o nome
familiar de Marocas. Não era costureira, nem proprietária, nem mestra de meninas; vá
excluindo as profissões e chegará lá. Morava na Rua do Sacramento. Já então era
esbelta, e, seguramente, mais linda do que hoje; modos sérios, linguagem limpa.
ASSIS, M. Machado de Assis: seus 30 melhores contos. Rio de Janeiro: Aguilar, 1961.
No diálogo, descortinam-se aspectos da condição da mulher em meados do século XIX.
O ponto de vista dos personagens manifesta conceitos segundo os quais a mulher",encontra um modo de dignificar-se na prática da caridade.,preserva a aparência jovem conforme seu estilo de vida.,condiciona seu bem-estar à estabilidade do casamento.,tem sua identidade e seu lugar referendados pelo homem.,"renuncia à sua participação no mercado de trabalho.
"
169,0,"TEXTO I
HAZOUMÉ, R. Nanawax. Plástico e tecido. Galerie Gagosian, 2009.
Disponível em: www.actuart.org. Acesso em: 19 jun. 2019.
TEXTO II
As máscaras não foram feitas para serem usadas; elas se concentram apenas nas
possibilidades antropomórficas dos recipientes plásticos descartados e, ao mesmo tempo,
chamam a atenção para a quantidade de lixo que se acumula em quase todas as cidades
ou aldeias africanas.
FARTHING, S. Tudo sobre arte. Rio de Janeiro: Sextante, 2011 (adaptado).
Romuald Hazoumé costuma dizer que sua obra apenas manda de volta ao oeste o refugo
de uma sociedade de consumo cada vez mais invasiva. A obra desse artista africano que
vive no Benin denota o(a)",empobrecimento do valor artístico pela combinação de diferentes matérias-primas.,reposicionamento estético de objetos por meio da mudança de função.,convite aos espectadores para interagir e completar obras inacabadas.,militância com temas da ecologia que marcam o continente africano.,"realidade precária de suas condições de produção artística.
"
170,0,"Comportamento geral
Você deve estampar sempre um ar de alegria 
E dizer: tudo tem melhorado 
Você deve rezar pelo bem do patrão 
E esquecer que está desempregado
Você merece 
Você merece 
Tudo vai bem, tudo legal 
Cerveja, samba, e amanhã, seu Zé 
Se acabarem com teu carnaval
Você deve aprender a baixar a cabeça 
E dizer sempre: muito obrigado 
São palavras que ainda te deixam dizer 
Por ser homem bem disciplinado
Deve pois só fazer pelo bem da nação 
Tudo aquilo que for ordenado
Pra ganhar um fuscão no juízo final 
E diploma de bem-comportado
GONZAGUINHA. Luiz Gonzaga Jr. Rio de Janeiro: Odeon, 1973 (fragmento).
Pela análise do tema e dos procedimentos argumentativos utilizados na letra da canção
composta por Gonzaguinha na década de 1970, infere-se o objetivo de",ironizar a incorporação de ideias e atitudes conformistas.,convencer o público sobre a importância dos deveres cívicos.,relacionar o discurso religioso à resolução de problemas sociais.,questionar o valor atribuído pela população às festas populares.,"defender uma postura coletiva indiferente aos valores dominantes.
"
171,0,"Se for possível, manda-me dizer: 
— É lua cheia. A casa está vazia — 
Manda-me dizer, e o paraíso 
Há de ficar mais perto, e mais recente 
Me há de parecer teu rosto incerto. 
Manda-me buscar se tens o dia 
Tão longo como a noite. Se é verdade 
Que sem mim só vês monotonia. 
E se te lembras do brilho das marés 
De alguns peixes rosados 
Numas águas 
E dos meus pés molhados, manda-me dizer: 
— É lua nova — 
E revestida de luz te volto a ver.
 
HILST, H. Júbilo, memória, noviciado da paixão. São Paulo: Cia. das Letras, 2018.
Falando ao outro, o eu lírico revela-se vocalizando um desejo que remete ao",ceticismo quanto à possibilidade do reencontro.,tédio provocado pela distância física do ser amado.,sonho de autorrealização desenhado pela memória.,julgamento implícito das atitudes de quem se afasta.,"questionamento sobre o significado do amor ausente.
"
172,0,"Falso moralista
Você condena o que a moçada anda fazendo 
e não aceita o teatro de revista 
arte moderna pra você não vale nada 
e até vedete você diz não ser artista 
Você se julga um tanto bom e até perfeito 
Por qualquer coisa deita logo falação 
Mas eu conheço bem o seu defeito 
e não vou fazer segredo não 
Você é visto toda sexta no Joá 
e não é só no Carnaval que vai pros bailes se acabar 
Fim de semana você deixa a companheira 
e no bar com os amigos bebe bem a noite inteira 
Segunda-feira chega na repartição 
pede dispensa para ir ao oculista 
e vai curar sua ressaca simplesmente 
Você não passa de um falso moralista 
 
NELSON SARGENTO. Sonho de um sambista. São Paulo: Eldorado, 1979.
As letras de samba normalmente se caracterizam por apresentarem marcas informais do
uso da língua. Nessa letra de Nelson Sargento, são exemplos dessas marcas",“falação” e “pros bailes”.,“você” e “teatro de revista”.,“perfeito” e “Carnaval”.,“bebe bem” e “oculista”.,"“curar” e “falso moralista”.
"
173,0,"Introdução a Alda
Dizem que ninguém mais a ama. Dizem que foi uma boa pessoa. Sua filha de doze
anos não a visita nunca e talvez raramente se lembre dela. Puseram-na numa cidade
triste de uniformes azuis e jalecos brancos, de onde não pôde mais sair. Lá, todos
gritam-lhe irritados, mal se aproxima, ou lhe batem, como se faz com sacos de areia para
treinar os músculos.
Sei que para todos ela já não é, e ninguém lhe daria uma maçã cheirosa, bem
vermelha. Mas não é verdade que alguém não a possa mais amar. Eu amo-a. Amo-a
quando a vejo por trás das grades de um palácio, onde se refugiou princesa, chegada
pelos caminhos da dor. Quando fora do reino sente o mundo de mil lanças, e selvagem
prepara-se, posta no olhar. Amo-a quando criança brinca na areia sem medo. Uns pés
descalços, uma mulher sem intenções. Cercada de mundo, às vezes sofrendo-o ainda.
CANÇADO, M. L. O sofredor do ver. Belo Horizonte: Autêntica, 2015.
Ao descrever uma mulher internada em um hospital psiquiátrico, o narrador compõe um
quadro que expressa sua percepção",irônica quanto aos efeitos do abandono familiar.,resignada em face dos métodos terapêuticos em vigor.,alimentada pela imersão lírica no espaço da segregação.,inspirada pelo universo pouco conhecido da mente humana.,"demarcada por uma linguagem alinhada à busca da lucidez.
"
174,0,"O pavão vermelho
Ora, a alegria, este pavão vermelho, 
está morando em meu quintal agora. 
Vem pousar como um sol em meu joelho 
quando é estridente em meu quintal a aurora.
Clarim de lacre, este pavão vermelho 
sobrepuja os pavões que estão lá fora. 
É uma festa de púrpura. E o assemelho 
a uma chama do lábaro da aurora.
É o próprio doge a se mirar no espelho. 
E a cor vermelha chega a ser sonora 
neste pavão pomposo e de chavelho.
Pavões lilases possuí outrora. 
Depois que amei este pavão vermelho, 
os meus outros pavões foram-se embora.
Costa, S. Poesia completa: Sosígenes Costa. Salvador: Conselho Estadual de Cultura, 2001.
Na construção do soneto, as cores representam um recurso poético que configura uma
imagem com a qual o eu lírico",revela a intenção de isolar-se em seu espaço.,simboliza a beleza e o esplendor da natureza.,experimenta a fusão de percepções sensoriais. ,metaforiza a conquista de sua plena realização.,"expressa uma visão de mundo mística e espiritualizada.  
"
175,0,"LICHTENSTEIN, R. Garota com bola. Óleo sobre tela, 153 cm x 91,9 cm. 
Museu de Arte Moderna de Nova York, 1961.
Disponível em: www.moma.org. Acesso em: 4 dez. 2018.
A obra, da década de 1960, pertencente ao movimento artístico Pop Art, explora a beleza
e a sensualidade do corpo feminino em uma situação de divertimento. Historicamente, a
sociedade inventou e continua reinventando o corpo como objeto de intervenções sociais,
buscando atender aos valores e costumes de cada época. Na reprodução desses
preceitos, a erotização do corpo feminino tem sido constituída pela",realização de exercícios físicos sistemáticos e excessivos.,utilização de medicamentos e produtos estéticos.,"educação do gesto, da vontade e do comportamento.",construção de espaços para vivência de práticas corporais.,"promoção de novas experiências de movimento humano no lazer.
"
176,0,"D’SALETE, M. Cumbe. São Paulo: Veneta, 2018, p. 10-11 (adaptado).
A sequência dos quadrinhos conjuga lirismo e violência ao",sugerir a impossibilidade de manutenção dos afetos.,revelar os corpos marcados pela brutalidade colonial.,representar o abatimento diante da desumanidade vivida.,acentuar a resistência identitária dos povos escravizados.,"expor os sujeitos alijados de sua ancestralidade pelo exílio.
"
177,0,"Naquele tempo, Itaguaí, que, como as demais vilas, arraiais e povoações da colônia,
não dispunha de imprensa, tinha dois modos de divulgar uma notícia; ou por meio de
cartazes manuscritos e pregados na porta da Câmara, e da matriz; — ou por meio de
matraca. 
     Eis em que consistia este segundo uso. Contratava-se um homem, por um ou mais
dias, para andar as ruas do povoado, com uma matraca na mão. De quando em quando
tocava a matraca, reunia-se gente, e ele anunciava o que lhe incumbiam, — um remédio
para sezões, umas terras lavradias, um soneto, um donativo eclesiástico, a melhor
tesoura da vila, o mais belo discurso do ano, etc. O sistema tinha inconvenientes para a
paz pública; mas era conservado pela grande energia de divulgação que possuía. Por
exemplo, um dos vereadores desfrutava a reputação de perfeito educador de cobras e
macacos, e aliás nunca domesticara um só desses bichos; mas tinha o cuidado de fazer
trabalhar a matraca todos os meses. E dizem as crônicas que algumas pessoas
afirmavam ter visto cascavéis dançando no peito do vereador; afirmação perfeitamente
falsa, mas só devida à absoluta confiança no sistema. Verdade, verdade, nem todas as
instituições do antigo regímen mereciam o desprezo do nosso século.
ASSIS, M. O alienista. Disponível em: www.dominiopubico.gov.br. Acesso em: 2 jun. 2019 (adaptado).
O fragmento faz uma referência irônica a formas de divulgação e circulação de
informações em uma localidade sem imprensa. Ao destacar a confiança da população no
sistema da matraca, o narrador associa esse recurso à disseminação de",campanhas políticas.,anúncios publicitários.,notícias de apelo popular.,informações não fidedignas.,"serviços de utilidade pública.
"
178,0,"      No ano em que o maior clarinetista que o Brasil conheceu, Abel Ferreira, faria 100
anos, o choro dá mostras de vivacidade. É quase um paradoxo que essa riquíssima
manifestação da genuína alma brasileira seja forte o suficiente para driblar a falta de
incentivos oficiais, a insensibilidade dos meios de comunicação e a amnésia
generalizada. “Ele trazia a alma brasileira derramada em sua sonoridade ímpar. Artur da
Távola, seguramente seu maior admirador, foi quem melhor o definiu, ‘alma sertaneja,
toque mozarteano’”. O acervo do músico autodidata nascido na mineira Coromandel,
autor de 50 músicas, entre as quais Chorando baixinho (1942), que o consagrou, amigo e
parceiro de Pixinguinha, com quem gravou Ingênuo (1958), permanece com os herdeiros
à espera de compilação adequada. O Museu da Imagem e do Som do Rio de Janeiro tem
a guarda do sax e do clarinete, doados em 1995. 
     Na avaliação de Leonor Bianchi, editora da Revista do Choro, “a música instrumental
fica apartada do que é popular porque não vai à sala de concerto. O público em geral tem
interesse em samba, pagode e axé”. Ela atribui essa situação à falta de conhecimento e à
pouca divulgação do gênero nas escolas.
FERRAZ, A. Disponível em: www.cartacapital.com.br. Acesso em: 22 abr. 2015 (adaptado).
Considerando-se o contexto, o gênero e o público-alvo, os argumentos trazidos pela
autora do texto buscam","atribuir o desconhecimento da obra de Abel Ferreira ao ensino de música nas
escolas.","reivindicar mais investimentos estatais para a preservação do acervo musical
nacional.","destacar a relevância histórica e a riqueza estética do choro no cenário musical
brasileiro.","apresentar ao leitor dados biográficos pouco conhecidos sobre a trajetória de Abel
Ferreira.","constatar a impopularidade do choro diante da preferência do público por músicas
populares.
Redação
Instruções - Redação
INSTRUÇÕES PARA A REDAÇÃO
1.   O rascunho da redação deve ser feito no espaço apropriado.
2.   O texto definitivo deve ser escrito à tinta preta, na folha própria, em até 30 linhas.
3.   A redação que apresentar cópia dos textos da Proposta de Redação ou do Caderno
de Questões terá o número de linhas copiadas desconsiderado para a contagem de
linhas.
4.   Receberá nota zero, em qualquer das situações expressas a seguir, a redação
que:
4.1.   tiver até 7 (sete) linhas escritas, sendo considerada “texto insuficiente”;
4.2.   fugir ao tema ou que não atender ao tipo dissertativo-argumentativo;
4.3.   apresentar parte do texto deliberadamente desconectada do tema proposto;
4.4.   apresentar nome, assinatura, rubrica ou outras formas de identificação no
espaço destinado ao texto.
Proposta de Redação - Redação
TEXTOS MOTIVADORES
TEXTO I
Toda sexta-feira, o ônibus azul e branco estacionado no pátio da Vara da Infância e da
Juventude, na Praça Onze, Centro do Rio, sacoleja com o entra e sai de gente a partir
das 9h. Do lado de fora, nunca menos de 50 pessoas, todas pobres ou muito pobres,
quase todas negras, cercam o veículo, perguntam, sentam e levantam, perguntam de
novo e esperam sem reclamar o tempo que for preciso. Adultos, velhos e crianças estão
ali para conseguir o que, no Brasil, é oficialmente reconhecido como o primeiro
documento da vida – a certidão de nascimento. [...] 
    Ao longo do discurso desses entrevistados, fica clara a forma como os usuários se
definem: “zero à esquerda”, “cachorro”, “um nada”, “pessoa que não existe”, entre outras,
todas são expressões que conformam claramente a ideia da pessoa sem registro de
nascimento sobre si mesma como uma pessoa sem valor, cuja existência nunca foi
oficialmente reconhecida pelo Estado.
ESCÓSSIA, F. M. Invisíveis: uma etnografia sobre identidade, direitos e cidadania nas trajetórias de brasileiros 
sem documento. Tese (Doutorado em História, Política e Bens Culturais). Fundação Getúlio Vargas. 
Rio de Janeiro, 2019.
TEXTO II
A Lei Nº 9 534 de 1997 tornou o registro de nascimento gratuito no Brasil. Só que o
problema persiste, mostrando que essa exclusão é complexa e não se explica apenas
pela dificuldade financeira em pagar pelo registro, por exemplo.
Disponível em: https://estudio.r7.com/. Acesso em: 22 jul. 2021 (adaptado).
 
TEXTO III
A certidão de nascimento é o primeiro e o mais importante documento do cidadão.
Com ele, a pessoa existe oficialmente para o Estado e a sociedade. Só de posse da
certidão é possível retirar outros documentos civis, como a carteira de trabalho, a carteira
de identidade, o título de eleitor e o Cadastro de Pessoa Física (CPF). Além disso, para
matricular uma criança na escola e ter acesso a benefícios sociais, a apresentação do
documento é obrigatória.
Disponível em: http://www.senado.leg.br/. Acesso em: 21 jul. 2021.
 
TEXTO IV
Disponível em: https://www.ufrgs.br/humanista. Acesso em: 26 jul. 2021 (adaptado).
 
PROPOSTA DE REDAÇÃO
A partir da leitura dos textos motivadores e com base nos conhecimentos construídos ao
longo de sua formação, redija texto dissertativo-argumentativo em modalidade escrita
formal da língua portuguesa sobre o tema “Invisibilidade e registro civil: garantia de
acesso à cidadania no Brasil”, apresentando proposta de intervenção que respeite os
direitos humanos. Selecione, organize e relacione, de forma coerente e coesa,
argumentos e fatos para a defesa de seu ponto de vista.
Ciências Humanas e suas Tecnologias
"
179,1,"Seu turno de trabalho acabou, você já está em casa e é hora do jantar da família.
Mas, em vez de relaxar, você começa a pensar na possibilidade de ter recebido alguma
mensagem importante no e-mail profissional ou no grupo de WhatsApp da empresa.
Imediatamente, você fica distante. Momentos depois, com alguns toques na tela do
celular, você está de volta ao ambiente de trabalho. O jantar e a família ficaram em
segundo plano.
A simples vontade de checar mensagens do trabalho pós-expediente prejudica sua 
saúde — e a de sua família. Disponível em: www.bbc.com. Acesso em: 4 dez. 2018.
O texto indica práticas nas relações cotidianas do trabalho que causam para o indivíduo a",proteção da vida privada.,ampliação de atividades extras.,elevação de etapas burocráticas.,diversificação do lazer recreativo.,"desobrigação de afazeres domésticos.
"
180,1,"Quando a taxa de remuneração do capital excede substancialmente a taxa de
crescimento da economia, pela lógica, a riqueza herdada aumenta mais rápido do que a
renda e a produção. Então, basta aos herdeiros poupar uma parte limitada da renda de
seu capital para que ele cresça mais rápido do que a economia como um todo. Sob essas
condições, é quase inevitável que a riqueza herdada supere a riqueza constituída durante
uma vida de trabalho, e que a concentração do capital atinja níveis muito altos.
PIKETTY, T. O capital no século XXI. Rio de Janeiro: Intrínseca, 2014 (adaptado).
Considerando os princípios que legitimam as democracias liberais, a lógica econômica
descrita no texto enfraquece o(a)",ideologia do mérito.,direito de nascimento.,eficácia da legislação.,ganho das financeiras.,"eficiência dos mercados.
"
181,1,"Atualmente, o Programa de Melhoramento ""Uvas do Brasil"" utiliza métodos clássicos
de melhoramento, como seleção massal, seleção clonal e hibridações. Ações de ajuste
de manejo de seleções avançadas vêm sendo desenvolvidas paralelamente ao Programa
de Melhoramento, no sentido de viabilização desses materiais. Ao longo dos seus 40
anos, uma grande equipe técnica trabalhou para executar projetos de pesquisa para
atender às necessidades e às demandas de diferentes atores da vitivinicultura nacional,
incluindo produtores de uvas de mesa para exportação do semiárido nordestino,
viticultores interessados em produzir sucos em regiões tropicais ou pequenos produtores
familiares da região da Serra Gaúcha, interessados em melhorar a qualidade do vinho
artesanal que produzem.
Programa de Melhoramento Genético ""Uvas do Brasil"". Disponível em: www.embrapa.br. 
Acesso em: 24 nov. 2018 (adaptado).
Para melhorar a produção agrícola nas regiões mencionadas, as técnicas referidas no
texto buscaram adaptar o cultivo aos(às)",espécies nativas ameaçadas.,cadeias econômicas autônomas.,estruturas fundiárias tradicionais.,elementos ambientais singulares.,"mercados consumidores internos.
"
182,1,"TEXTO I
Portadoras de mensagem espiritual do passado, as obras monumentais de cada
povo perduram no presente como o testemunho vivo de suas tradições seculares. A
humanidade, cada vez mais consciente da unidade dos valores humanos, as considera
um bem comum e, perante as gerações futuras, se reconhece solidariamente responsável
por preservá-las, impondo a si mesma o dever de transmiti-las na plenitude de sua
autenticidade.
Carta de Veneza, 31 de maio de 1964. Disponível em: www.iphan.gov.br. Acesso em: 7 out. 2019.
TEXTO II
Os sistemas tradicionais de proteção se mostram cada vez menos eficientes diante
do processo acelerado de urbanização e transformação de nossa sociedade. A legislação
de proteção peca por considerar o monumento, até certo ponto, desvinculado da
realidade socioeconômica. O tombamento, ao decretar a imutabilidade do monumento,
provoca a redução de seu valor venal e o abandono, o que é uma causa, ainda que lenta,
de destruição inevitável.
TELLES, L. S. Manual do patrimônio histórico. Porto Alegre; Caxias do Sul: 
Escola Superior de Teologia São Lourenço de Brindes, 1977 (adaptado).
Escritos em temporalidade histórica aproximada, os textos se distanciam ao
apresentarem pontos de vista diferentes sobre a(s)","humanidade, cada vez mais consciente da unidade dos valores humanos, as considera
um bem comum e, perante as gerações futuras, se reconhece solidariamente responsável
por preservá-las, impondo a si mesma o dever de transmiti-las na plenitude de sua
autenticidade.
Carta de Veneza, 31 de maio de 1964. Disponível em: www.iphan.gov.br. Acesso em: 7 out. 2019.
TEXTO II
Os sistemas tradicionais de proteção se mostram cada vez menos eficientes diante
do processo acelerado de urbanização e transformação de nossa sociedade. A legislação
de proteção peca por considerar o monumento, até certo ponto, desvinculado da
realidade socioeconômica. O tombamento, ao decretar a imutabilidade do monumento,
provoca a redução de seu valor venal e o abandono, o que é uma causa, ainda que lenta,
de destruição inevitável.
TELLES, L. S. Manual do patrimônio histórico. Porto Alegre; Caxias do Sul: 
Escola Superior de Teologia São Lourenço de Brindes, 1977 (adaptado).
Escritos em temporalidade histórica aproximada, os textos se distanciam ao
apresentarem pontos de vista diferentes sobre a(s)",substituição de materiais de valor artístico.,políticas de conservação de bens culturais.,defesa da privatização de sítios arqueológicos.,"medidas de salvaguarda de peças museológicas.
"
183,1,"TEXTO I
Em 2016, foram gerados 44,7 milhões de toneladas de resíduos eletrônicos, um
aumento de 8% na comparação com 2014. Especialistas previram um crescimento de
mais 17%, para 52,2 milhões de toneladas, até 2021.
Disponível em: https://nacoesunidas.org. Acesso em: 12 out. 2019 (adaptado).
TEXTO II
Há ainda quem exporte deliberadamente lixo eletrônico para o Gana. É mais caro
reciclar devidamente os resíduos no mundo industrializado, onde até existem os recursos
e a tecnologia. Um negócio muito mais lucrativo é vender o lixo eletrônico a negociantes
locais, que o importam alegando tratar-se de material usado. Os negociantes depois
vendem o lixo aos jovens no mercado, ou noutro lado, que o desmantelam e extraem os
fios de cobre. Estes são derretidos em lareiras ao ar livre, poluindo o ar e, muitas vezes,
intoxicando diretamente os próprios jovens.
KALEDZI, I.; SOUZA, G. Disponível em: www.dw.com. Acesso em: 12 out. 2019 (adaptado). 
No contexto das discussões ambientais, as práticas descritas nos textos refletem um
padrão de relações derivado do(a):",Exercício pleno da cidadania.,Divisão internacional do trabalho.,Gestão empresarial do toyotismo.,Concepção sustentável da economia.,"Protecionismo alfandegário dos Estados.
"
184,1,"Preços justos e autorizações de uso da água devem garantir de forma adequada que
a retirada de água, bem como o retorno de efluentes, mantenham operações eficientes e
ambientalmente sustentáveis, de maneira que sejam adaptáveis às peculiaridades e
necessidades da indústria e da irrigação em larga escala, bem como às atividades da
agricultura em pequena escala e de subsistência.
UNESCO. Relatório Mundial das Nações Unidas sobre Desenvolvimento 
dos Recursos Hídricos. Água para um mundo sustentável. Unesco, 2015.
Considerando o debate sobre segurança hídrica, a proposta apresentada no texto está
pautada no(a)",distribuição equitativa do abastecimento.,monitoramento do fornecimento urbano.,racionamento da capacidade fluvial.,revitalização gradativa de solos.,"geração de produtos recicláveis.
"
185,1,"Durante os anos de 1854-55, o governo brasileiro — por meio de sua representação
diplomática em Londres — e os livre-cambistas ingleses — nas colunas do Daily News e
na Câmara dos Comuns — aumentaram a pressão pela revogação da Lei Aberdeen. O
governo britânico, entretanto, ainda receava que, sem um tratado anglo-brasileiro
satisfatório para substituí-la, não haveria nada que impedisse os brasileiros de um dia
voltarem aos seus velhos hábitos.
BETHELL, L. A abolição do comércio brasileiro de escravos. Brasília: Senado Federal, 2002 (adaptado).
As tensões diplomáticas expressas no texto indicam o interesse britânico em",estabelecer jurisdição conciliadora.,compartilhar negócios marítimos.,fomentar políticas higienistas.,manter a proibição comercial.,"promover o negócio familiar.
"
